Hotel,Overall Rating,Total Reviews,Cleanliness,Staff and Service,Amenities,Property Conditions and Facilities,Eco-Friendliness
"C. Baldwin, Curio Collection by Hilton",8.2 out of 10 Very good,574 verified reviews,9.0/10,8.6/10,8.0/10,8.8/10,8.4/10
Hampton Inn & Suites Houston Heights I-10,9.2 out of 10 Wonderful,"1,001 verified reviews",9.4/10,9.4/10,9.2/10,9.2/10,9.2/10
Blossom Hotel Houston,9.2 out of 10 Wonderful,"1,947 verified reviews",9.6/10,9.2/10,9.2/10,9.6/10,9.4/10
Homewood Suites by Hilton Houston Memorial,9.4 out of 10 Exceptional,700 verified reviews,9.6/10,9.4/10,9.4/10,9.6/10,9.6/10
Homewood Suites Houston Downtown,9.2 out of 10 Wonderful,730 verified reviews,9.4/10,9.2/10,8.8/10,9.4/10,9.2/10
The Lancaster Hotel,9.8 out of 10 Exceptional,"1,484 verified reviews",10.0/10,9.8/10,9.6/10,9.8/10,9.4/10
Hilton Americas-Houston,9.2 out of 10 Wonderful,"1,073 verified reviews",9.4/10,9.4/10,9.4/10,9.4/10,9.4/10
STOP INN STAY HOSTELS,6.2 out of 10 Good,12 verified reviews,5.8/10,6.4/10,6.6/10,6.6/10,6.8/10
Cambria Hotel Houston Downtown Convention Center,8.8 out of 10 Excellent,"1,284 verified reviews",9.4/10,9.0/10,8.6/10,9.0/10,8.8/10
Hilton Garden Inn Houston/Galleria Area,8.4 out of 10 Very good,"1,001 verified reviews",9.0/10,8.8/10,8.4/10,8.8/10,8.6/10
La Colombe d'Or Hotel,9.2 out of 10 Wonderful,60 verified reviews,9.8/10,9.4/10,9.2/10,9.2/10,9.4/10
Hyatt Regency Houston,9.0 out of 10 Wonderful,"1,489 verified reviews",9.2/10,9.0/10,8.8/10,9.2/10,9.2/10
DoubleTree by Hilton Houston Brookhollow,8.0 out of 10 Very good,"2,487 verified reviews",8.4/10,8.6/10,8.4/10,8.2/10,8.4/10
"Heights House Hotel, Ascend Hotel Collection",8.2 out of 10 Very good,758 verified reviews,8.4/10,8.8/10,7.8/10,8.0/10,8.2/10
"Magnolia Hotel Houston, A Tribute Portfolio Hotel",9.0 out of 10 Wonderful,"1,001 verified reviews",9.4/10,9.2/10,8.6/10,9.0/10,8.8/10
"The Sam Houston, Curio Collection by Hilton",8.4 out of 10 Very good,"1,000 verified reviews",9.0/10,8.6/10,7.4/10,8.4/10,7.8/10
AC Hotel by Marriott Houston Downtown,8.6 out of 10 Excellent,695 verified reviews,9.4/10,9.0/10,8.6/10,9.2/10,9.0/10
Hyatt Regency Houston/Galleria,8.4 out of 10 Very good,"1,375 verified reviews",8.6/10,8.4/10,8.4/10,8.8/10,8.8/10
"The Chifley Houston, Tapestry Collection by Hilton",8.2 out of 10 Very good,"1,006 verified reviews",8.6/10,8.6/10,7.8/10,8.2/10,8.6/10
Wyndham Houston near NRG Park/Medical Center,6.8 out of 10 Good,"1,003 verified reviews",7.2/10,7.6/10,6.4/10,6.4/10,7.0/10
Four Seasons Hotel Houston,9.2 out of 10 Wonderful,"1,015 verified reviews",9.6/10,9.6/10,9.2/10,9.0/10,9.4/10
The Post Oak Hotel at Uptown Houston,9.4 out of 10 Exceptional,590 verified reviews,9.8/10,9.6/10,9.8/10,9.8/10,9.6/10
Home2 Suites by Hilton at the Galleria,8.8 out of 10 Excellent,450 verified reviews,9.0/10,8.8/10,8.6/10,9.0/10,8.8/10
DoubleTree by Hilton Houston Westchase,9.2 out of 10 Wonderful,183 verified reviews,9.4/10,9.2/10,9.0/10,9.0/10,9.0/10
Hotel Granduca Houston,9.4 out of 10 Exceptional,958 verified reviews,9.6/10,9.4/10,9.2/10,9.4/10,8.8/10
Hampton Inn Houston-Brookhollow,8.2 out of 10 Very good,"1,000 verified reviews",8.8/10,8.6/10,7.8/10,8.4/10,8.0/10
Haven Inn & Suites Downtown Houston,9.2 out of 10 Wonderful,"1,001 verified reviews",9.4/10,9.4/10,9.0/10,9.2/10,9.2/10
Hilton Houston Westchase,8.2 out of 10 Very good,"1,004 verified reviews",8.6/10,8.4/10,7.6/10,8.0/10,8.0/10
Four Points by Sheraton Houston West,8.6 out of 10 Excellent,390 verified reviews,9.2/10,8.8/10,7.6/10,8.8/10,7.8/10
"Crowne Plaza Houston Galleria Area, an IHG Hotel",7.6 out of 10 Good,"1,003 verified reviews",8.0/10,8.0/10,7.0/10,7.6/10,8.0/10
Hampton Inn Houston-Near The Galleria,8.0 out of 10 Very good,"1,000 verified reviews",8.2/10,8.4/10,7.6/10,7.8/10,7.6/10
Embassy Suites by Hilton Houston Near the Galleria,7.8 out of 10 Good,"1,249 verified reviews",7.8/10,8.2/10,7.4/10,7.6/10,7.8/10
DoubleTree by Hilton Hotel & Suites Houston by the Galleria,7.4 out of 10 Good,"1,003 verified reviews",7.8/10,8.0/10,7.2/10,7.4/10,7.8/10
"Hilton Garden Inn Houston Medical Center, TX",9.4 out of 10 Exceptional,438 verified reviews,9.6/10,9.6/10,9.4/10,9.6/10,9.4/10
Hilton Houston Plaza/Medical Center,8.0 out of 10 Very good,"1,001 verified reviews",8.6/10,8.6/10,8.0/10,8.0/10,8.2/10
Hampton Inn Houston Downtown,9.0 out of 10 Wonderful,"1,000 verified reviews",9.2/10,9.2/10,8.6/10,9.0/10,8.8/10
Courtyard by Marriott Houston Medical Center/NRG Park,8.6 out of 10 Excellent,"1,002 verified reviews",8.8/10,8.8/10,8.4/10,8.6/10,8.8/10
Homewood Suites by Hilton Houston Near the Galleria,8.4 out of 10 Very good,"1,001 verified reviews",8.6/10,8.8/10,8.2/10,8.4/10,8.2/10
"InterContinental Houston, an IHG Hotel",9.4 out of 10 Exceptional,"1,007 verified reviews",9.6/10,9.4/10,9.2/10,9.6/10,9.2/10
The Westin Houston Downtown,9.2 out of 10 Wonderful,"1,000 verified reviews",9.6/10,9.4/10,9.2/10,9.6/10,9.6/10
DoubleTree by Hilton Houston Medical Center Hotel & Suites,8.2 out of 10 Very good,22 verified reviews,8.6/10,8.8/10,7.0/10,8.4/10,8.4/10
Hampton Inn Houston I-10W Energy Corridor,8.6 out of 10 Excellent,790 verified reviews,9.0/10,9.0/10,8.8/10,8.6/10,8.4/10
The Westin Houston Medical Center/Museum District,9.0 out of 10 Wonderful,"1,007 verified reviews",9.4/10,9.0/10,9.0/10,9.2/10,9.0/10
Residence Inn by Marriott Houston Downtown/Convention Center,8.6 out of 10 Excellent,626 verified reviews,9.2/10,8.8/10,8.0/10,9.0/10,8.6/10
DoubleTree by Hilton Houston Intercontinental Airport,8.4 out of 10 Very good,"1,002 verified reviews",8.8/10,8.6/10,8.2/10,8.4/10,8.4/10
Omni Houston Hotel,8.6 out of 10 Excellent,"1,266 verified reviews",9.2/10,9.0/10,8.6/10,9.0/10,8.8/10
JW Marriott Houston Downtown,9.2 out of 10 Wonderful,"1,000 verified reviews",9.6/10,9.4/10,9.0/10,9.6/10,9.2/10
Sleep Inn & Suites Near Downtown North,8.4 out of 10 Very good,553 verified reviews,9.0/10,8.6/10,7.0/10,8.8/10,7.8/10
Sheraton North Houston at George Bush Intercontinental,8.0 out of 10 Very good,"1,000 verified reviews",8.4/10,8.4/10,7.8/10,7.8/10,8.2/10
Hilton Houston Post Oak by the Galleria,8.2 out of 10 Very good,"1,211 verified reviews",8.4/10,8.6/10,8.0/10,8.2/10,8.0/10
Courtyard by Marriott Houston by the Galleria,8.6 out of 10 Excellent,"1,001 verified reviews",9.0/10,9.0/10,8.0/10,8.8/10,8.4/10
Signature Inn Houston Galleria,8.4 out of 10 Very good,181 verified reviews,8.4/10,8.8/10,7.6/10,8.4/10,8.2/10
Hyatt Place Houston/Galleria,8.2 out of 10 Very good,"1,462 verified reviews",8.4/10,8.2/10,7.8/10,8.6/10,8.4/10
DoubleTree by Hilton Hotel Houston - Greenway Plaza,7.4 out of 10 Good,"1,001 verified reviews",7.8/10,8.0/10,7.2/10,7.6/10,7.8/10
Hampton Inn & Suites Houston Medical Center NRG Park,8.4 out of 10 Very good,"1,000 verified reviews",8.8/10,8.8/10,8.2/10,8.6/10,8.4/10
Modern B & B,9.0 out of 10 Wonderful,132 verified reviews,9.0/10,9.4/10,8.6/10,8.8/10,9.4/10
Hilton University of Houston,8.8 out of 10 Excellent,656 verified reviews,9.4/10,9.0/10,8.2/10,9.0/10,8.4/10
Marriott Marquis Houston,8.6 out of 10 Excellent,"1,002 verified reviews",9.2/10,8.8/10,9.0/10,9.2/10,9.0/10
Comfort Suites near Texas Medical Center - NRG Stadium,8.6 out of 10 Excellent,455 verified reviews,9.0/10,8.8/10,8.4/10,8.6/10,8.6/10
Courtyard by Marriott Houston Heights/I-10,9.4 out of 10 Exceptional,438 verified reviews,9.8/10,9.6/10,9.2/10,9.6/10,9.4/10
Houston Marriott Westchase,8.0 out of 10 Very good,"1,004 verified reviews",8.4/10,8.4/10,8.0/10,8.2/10,8.0/10
Hampton Inn & Suites Houston-Bush Intercontinental Aprt,8.6 out of 10 Excellent,"1,003 verified reviews",9.0/10,9.0/10,8.6/10,8.8/10,8.8/10
Palace Inn Blue Federal Road,9.4 out of 10 Exceptional,45 verified reviews,9.8/10,9.8/10,9.6/10,9.8/10,9.2/10
Fairfield Inn & Suites Houston Northwest/Willowbrook,9.0 out of 10 Wonderful,412 verified reviews,9.4/10,9.2/10,9.2/10,9.4/10,9.0/10
Comfort Suites Houston West at Clay Road,8.6 out of 10 Excellent,854 verified reviews,8.6/10,8.8/10,8.0/10,8.4/10,8.4/10
Extended Stay America Suites Houston Med Ctr NRG Park Kirby,6.6 out of 10 Good,702 verified reviews,6.8/10,7.4/10,6.0/10,6.6/10,6.6/10
Sonder The Hogg Palace,8.4 out of 10 Very good,563 verified reviews,9.0/10,8.6/10,8.4/10,8.8/10,8.2/10
Howard Johnson by Wyndham Houston Heights/Downtown,7.0 out of 10 Good,524 verified reviews,7.6/10,7.4/10,6.0/10,7.2/10,6.2/10
Hilton Garden Inn Houston Cypress Station,8.2 out of 10 Very good,328 verified reviews,9.0/10,8.6/10,7.8/10,8.8/10,8.4/10
Palace Inn Blue US 59 & Gessner,9.2 out of 10 Wonderful,61 verified reviews,9.6/10,9.4/10,9.0/10,9.4/10,9.2/10
Americas Best Value Inn Medical Center Downtown,7.8 out of 10 Good,"1,000 verified reviews",7.8/10,8.2/10,7.0/10,7.4/10,7.2/10
"Home2 Suites by Hilton Houston Medical Center, TX",9.4 out of 10 Exceptional,253 verified reviews,9.6/10,9.4/10,9.2/10,9.6/10,9.4/10
Super 8 by Wyndham Houston/NASA,8.2 out of 10 Very good,"1,000 verified reviews",8.4/10,8.4/10,8.2/10,8.0/10,8.4/10
Courtyard by Marriott Houston NW/290 Corridor,8.8 out of 10 Excellent,737 verified reviews,9.2/10,9.2/10,8.2/10,9.2/10,8.8/10
SpringHill Suites by Marriott Houston Hwy. 290/NW Cypress,8.8 out of 10 Excellent,336 verified reviews,9.2/10,9.0/10,8.2/10,9.2/10,9.0/10
Best Western Galleria Inn & Suites,7.8 out of 10 Good,905 verified reviews,8.0/10,8.2/10,7.6/10,7.8/10,8.0/10
Four Points by Sheraton Houston Intercontinental Airport,8.4 out of 10 Very good,836 verified reviews,9.0/10,8.6/10,7.8/10,8.8/10,8.2/10
Wingate Houston near NRG Park/Medical Center,6.8 out of 10 Good,671 verified reviews,7.0/10,7.6/10,5.8/10,6.2/10,6.6/10
Spark by Hilton Houston Bush Intercontinental Airport,8.6 out of 10 Excellent,"1,000 verified reviews",9.0/10,8.8/10,8.2/10,8.6/10,8.2/10
MainStay Suites Texas Medical Center/Reliant Park,8.0 out of 10 Very good,"1,001 verified reviews",8.2/10,8.4/10,7.6/10,7.8/10,8.0/10
"Holiday Inn Express Houston - Galleria Area, an IHG Hotel",9.2 out of 10 Wonderful,770 verified reviews,9.6/10,9.2/10,9.2/10,9.6/10,9.4/10
La Quinta Inn & Suites by Wyndham Houston Channelview,8.6 out of 10 Excellent,580 verified reviews,9.0/10,8.8/10,8.6/10,9.0/10,8.8/10
Hotel Derek,6.4 out of 10 Good,"2,049 verified reviews",7.0/10,7.2/10,6.4/10,6.6/10,6.4/10
"Holiday Inn Houston Downtown, an IHG Hotel",8.4 out of 10 Very good,"1,001 verified reviews",9.0/10,8.8/10,8.0/10,8.6/10,8.6/10
SpringHill Suites Houston Medical Center/NRG Park,8.8 out of 10 Excellent,"1,001 verified reviews",8.8/10,9.2/10,8.4/10,8.6/10,9.0/10
Comfort Suites Westchase Houston Energy Corridor,8.6 out of 10 Excellent,421 verified reviews,8.6/10,8.8/10,7.8/10,8.2/10,7.8/10
Baymont by Wyndham Houston Hobby Airport,8.8 out of 10 Excellent,654 verified reviews,8.8/10,8.8/10,8.0/10,8.8/10,8.4/10
Holiday Inn Express & Suites Houston S - Medical Ctr Area,9.2 out of 10 Wonderful,"1,000 verified reviews",9.6/10,9.2/10,9.2/10,9.4/10,9.2/10
Comfort Suites - Near The Galleria,8.0 out of 10 Very good,551 verified reviews,8.4/10,8.6/10,7.6/10,7.8/10,7.6/10
Crystal Inn Jacinto City,8.6 out of 10 Excellent,41 verified reviews,9.0/10,9.2/10,9.6/10,9.0/10,8.6/10
Hilton Garden Inn Houston NW America Plaza,9.0 out of 10 Wonderful,"1,005 verified reviews",9.4/10,9.2/10,7.6/10,9.2/10,8.6/10
Hilton Garden Inn Houston Energy Corridor,8.8 out of 10 Excellent,538 verified reviews,9.2/10,9.2/10,8.4/10,9.0/10,8.8/10
La Quinta Inn & Suites by Wyndham Houston East at Normandy,8.2 out of 10 Very good,532 verified reviews,8.6/10,8.6/10,8.4/10,8.2/10,8.4/10
Fairfield Inn & Suites by Marriott Houston Hobby Airport.,8.0 out of 10 Very good,"1,001 verified reviews",8.4/10,8.6/10,7.6/10,8.2/10,8.0/10
Houston Marriott South at Hobby Airport,8.4 out of 10 Very good,"1,003 verified reviews",8.6/10,8.6/10,8.4/10,8.6/10,8.8/10
Home2 Suites by Hilton Houston IAH Airport Beltway 8,8.2 out of 10 Very good,384 verified reviews,8.6/10,8.6/10,8.4/10,8.8/10,8.6/10
Comfort Inn & Suites Southwest Fwy at Westpark,7.2 out of 10 Good,"1,001 verified reviews",7.0/10,7.8/10,7.2/10,7.0/10,7.0/10
Quality Suites Houston Hobby Airport,8.6 out of 10 Excellent,604 verified reviews,9.0/10,9.0/10,8.2/10,9.0/10,8.8/10
The Residency Suites,9.0 out of 10 Wonderful,179 verified reviews,9.4/10,9.4/10,8.2/10,9.2/10,8.8/10
Extended Stay America Suites Houston Galleria Westheimer,6.6 out of 10 Good,"1,001 verified reviews",6.8/10,7.4/10,6.0/10,6.4/10,6.8/10
La Quinta Inn & Suites by Wyndham Houston NW Beltway8/WestRD,9.0 out of 10 Wonderful,679 verified reviews,9.4/10,9.2/10,8.8/10,9.4/10,9.0/10
Best Western Plus Hobby Airport Inn & Suites,8.8 out of 10 Excellent,"1,003 verified reviews",9.0/10,9.0/10,8.6/10,8.8/10,8.6/10
"Holiday Inn Express & Suites Houston IAH - Beltway 8, an IHG Hotel",8.2 out of 10 Very good,"1,002 verified reviews",8.6/10,8.4/10,8.2/10,8.4/10,8.2/10
Doubletree by Hilton Houston Hobby Airport,8.6 out of 10 Excellent,914 verified reviews,9.0/10,8.8/10,8.6/10,8.6/10,8.8/10
"Staybridge Suites Houston IAH - Beltway 8, an IHG Hotel",8.2 out of 10 Very good,693 verified reviews,8.4/10,8.4/10,8.2/10,8.4/10,7.8/10
Embassy Suites by Hilton Houston West - Katy,9.2 out of 10 Wonderful,863 verified reviews,9.4/10,9.4/10,9.4/10,9.4/10,9.0/10
Homewood Suites Houston - Northwest/Cypress-Fairbanks,9.0 out of 10 Wonderful,739 verified reviews,9.2/10,9.0/10,8.4/10,9.0/10,7.8/10
"Crowne Plaza Houston Med Ctr-Galleria Area, an IHG Hotel",7.2 out of 10 Good,"1,002 verified reviews",7.8/10,8.0/10,7.0/10,7.0/10,7.8/10
Hampton Inn & Suites Houston North IAH,8.2 out of 10 Very good,"1,002 verified reviews",8.6/10,8.6/10,8.2/10,8.4/10,8.0/10
Comfort Inn & Suites Houston I-10 West Energy Corridor,7.4 out of 10 Good,137 verified reviews,7.8/10,8.2/10,6.8/10,7.6/10,7.8/10
"Holiday Inn Houston Hobby Airport, an IHG Hotel",7.2 out of 10 Good,746 verified reviews,7.6/10,7.8/10,7.2/10,7.0/10,7.4/10
Embassy Suites by Hilton Houston Energy Corridor,9.2 out of 10 Wonderful,"1,250 verified reviews",9.4/10,9.2/10,9.0/10,9.2/10,9.4/10
"Hilton Garden Inn Houston Hobby Airport, TX",9.0 out of 10 Wonderful,698 verified reviews,9.4/10,9.2/10,8.8/10,9.4/10,9.2/10
La Quinta Inn & Suites by Wyndham Houston Southwest,6.8 out of 10 Good,662 verified reviews,7.2/10,7.6/10,6.8/10,6.6/10,7.4/10
TownePlace Suites Houston Brookhollow,8.6 out of 10 Excellent,386 verified reviews,8.8/10,9.0/10,8.6/10,8.8/10,8.0/10
Hampton Inn Houston I-10 East,8.8 out of 10 Excellent,429 verified reviews,9.2/10,9.0/10,8.6/10,9.2/10,8.6/10
Palace Inn Wayside,8.0 out of 10 Very good,127 verified reviews,8.6/10,8.0/10,7.6/10,8.0/10,8.6/10
"Holiday Inn Westway Park, an IHG Hotel",8.8 out of 10 Excellent,402 verified reviews,9.0/10,8.8/10,8.0/10,9.0/10,8.0/10
Sleep Inn & Suites Highway 290/NW Freeway,8.2 out of 10 Very good,303 verified reviews,8.4/10,8.6/10,8.2/10,8.2/10,8.0/10
Hilton Houston North,8.2 out of 10 Very good,"1,204 verified reviews",8.8/10,8.6/10,8.0/10,8.4/10,8.8/10
Days Inn & Suites by Wyndham Houston Hobby Airport,8.6 out of 10 Excellent,"1,001 verified reviews",9.0/10,8.8/10,8.4/10,8.8/10,8.8/10
MainStay Suites Houston NASA/Clear Lake,8.4 out of 10 Very good,580 verified reviews,8.6/10,8.8/10,7.8/10,8.2/10,7.8/10
Fairfield Inn & Suites Houston Memorial City Area,9.2 out of 10 Wonderful,378 verified reviews,9.6/10,9.4/10,9.4/10,9.6/10,9.4/10
Houston Marriott Energy Corridor,8.6 out of 10 Excellent,715 verified reviews,9.0/10,8.8/10,8.2/10,8.8/10,8.8/10
Home2 Suites by Hilton Houston Energy Corridor,8.8 out of 10 Excellent,707 verified reviews,9.0/10,9.2/10,8.8/10,9.0/10,8.6/10
Hilton Houston NASA Clear Lake,8.0 out of 10 Very good,"1,302 verified reviews",8.4/10,8.4/10,7.6/10,7.8/10,8.4/10
Crystal Inn Downtown,8.4 out of 10 Very good,16 verified reviews,8.8/10,8.0/10,10.0/10,8.8/10,6.8/10
Home2 Suites by Hilton Houston-Pearland,8.6 out of 10 Excellent,264 verified reviews,9.4/10,9.0/10,9.0/10,9.4/10,9.4/10
Comfort Suites Northwest Houston at Beltway 8,9.4 out of 10 Exceptional,"1,000 verified reviews",9.6/10,9.6/10,9.2/10,9.6/10,9.4/10
Hampton Inn & Suites Houston East Beltway 8,9.4 out of 10 Exceptional,120 verified reviews,9.6/10,9.4/10,9.0/10,9.6/10,9.4/10
"Country Inn & Suites by Radisson, Houston Northwest, TX",7.4 out of 10 Good,701 verified reviews,7.6/10,8.2/10,6.6/10,7.4/10,6.8/10
Baymont by Wyndham Houston/Westchase,8.0 out of 10 Very good,"1,190 verified reviews",8.0/10,8.8/10,7.0/10,7.8/10,6.8/10
Best Western Premier Ashton Suites-Willowbrook,8.6 out of 10 Excellent,527 verified reviews,9.2/10,9.0/10,8.2/10,9.2/10,8.6/10
"The Westin Houston, Memorial City",9.0 out of 10 Wonderful,789 verified reviews,9.4/10,9.2/10,8.8/10,9.2/10,8.8/10
Home2 Suites by Hilton Houston Westchase,8.6 out of 10 Excellent,531 verified reviews,8.8/10,8.8/10,9.0/10,9.0/10,9.0/10
Aloft Houston by the Galleria,8.0 out of 10 Very good,"1,000 verified reviews",8.4/10,8.4/10,8.0/10,8.0/10,8.0/10
Hilton Garden Inn Houston/Bush Intercontinental Airport,8.4 out of 10 Very good,695 verified reviews,9.0/10,8.8/10,8.2/10,8.4/10,8.6/10
Palace Inn Beltway 8 & Westview,9.2 out of 10 Wonderful,96 verified reviews,9.4/10,9.4/10,9.2/10,9.2/10,9.6/10
Comfort Suites near Westchase on Beltway 8,7.8 out of 10 Good,"1,004 verified reviews",8.4/10,8.2/10,8.0/10,8.0/10,8.0/10
Summit Inn - Houston Medical Center,6.6 out of 10 Good,180 verified reviews,7.0/10,7.6/10,6.0/10,6.8/10,6.8/10
"Staybridge Suites Houston I-10 West-beltway 8, an IHG Hotel",8.6 out of 10 Excellent,385 verified reviews,8.8/10,8.8/10,8.4/10,9.0/10,8.2/10
Houston Marriott Medical Center/Museum District,9.0 out of 10 Wonderful,"1,004 verified reviews",9.4/10,9.2/10,8.8/10,9.2/10,9.0/10
GreenTree Inn Houston IAH Airport,6.8 out of 10 Good,"1,000 verified reviews",7.2/10,7.6/10,6.2/10,6.8/10,6.6/10
Homewood Suites by Hilton Houston Clear Lake NASA,9.0 out of 10 Wonderful,558 verified reviews,9.0/10,9.2/10,8.6/10,8.6/10,8.2/10
La Quinta Inn & Suites by Wyndham Houston Bush IAH South,7.0 out of 10 Good,"1,763 verified reviews",6.6/10,7.8/10,6.8/10,6.2/10,7.0/10
Extended Stay America Suites Houston Med Ctr Braeswood Bl,6.2 out of 10 Good,"1,002 verified reviews",6.4/10,7.0/10,5.8/10,6.2/10,6.6/10
Quality Inn & Suites NRG Park - Medical Center,6.2 out of 10 Good,"1,000 verified reviews",6.2/10,7.2/10,5.4/10,5.8/10,5.6/10
"Holiday Inn NW Houston Beltway 8, an IHG Hotel",8.4 out of 10 Very good,202 verified reviews,9.0/10,8.6/10,8.2/10,9.0/10,8.8/10
Towneplace Suites Houston Hobby Airport,9.0 out of 10 Wonderful,329 verified reviews,9.2/10,9.2/10,9.2/10,9.2/10,9.2/10
Athens Hotel Suites,6.4 out of 10 Good,738 verified reviews,6.8/10,6.8/10,6.8/10,6.2/10,7.0/10
Homewood Suites by Hilton Houston-Westchase,8.6 out of 10 Excellent,431 verified reviews,8.8/10,8.8/10,8.2/10,8.6/10,8.0/10
The Westin Oaks Houston at the Galleria,8.8 out of 10 Excellent,"1,000 verified reviews",9.2/10,9.0/10,8.6/10,9.0/10,9.0/10
"Holiday Inn Express & Suites Houston - Memorial Park Area, an IHG Hotel",8.0 out of 10 Very good,753 verified reviews,8.6/10,8.6/10,7.8/10,8.0/10,7.8/10
Comfort Inn & Suites Houston I-45 North - IAH,8.4 out of 10 Very good,852 verified reviews,9.0/10,8.4/10,8.0/10,8.8/10,7.8/10
Comfort Inn & Suites FM1960-Champions,8.0 out of 10 Very good,503 verified reviews,8.2/10,8.4/10,7.6/10,8.0/10,7.8/10
"Homewood Suites by Hilton Houston NW at Beltway 8, TX",8.6 out of 10 Excellent,207 verified reviews,8.8/10,8.8/10,8.6/10,9.0/10,9.0/10
"Holiday Inn & Suites Houston NW - Willowbrook, an IHG Hotel",9.0 out of 10 Wonderful,270 verified reviews,9.4/10,9.0/10,8.8/10,9.4/10,9.0/10
Four Points by Sheraton Houston Hobby Airport,8.0 out of 10 Very good,"1,000 verified reviews",8.4/10,8.2/10,7.4/10,8.2/10,7.8/10
"Staybridge Suites Houston NW Cypress Crossings, an IHG Hotel",9.4 out of 10 Exceptional,82 verified reviews,9.6/10,9.8/10,9.2/10,9.6/10,9.6/10
Homewood Suites Houston West Energy Corridor,8.6 out of 10 Excellent,183 verified reviews,8.8/10,8.8/10,8.2/10,8.8/10,8.8/10
"Holiday Inn Houston Intercontinental Airport, an IHG Hotel",7.4 out of 10 Good,"1,001 verified reviews",7.8/10,8.2/10,7.6/10,7.2/10,8.0/10
Courtyard by Marriott Houston NASA/Clear Lake,9.2 out of 10 Wonderful,943 verified reviews,9.6/10,9.2/10,8.6/10,9.4/10,9.0/10
The Westin Galleria Houston,8.8 out of 10 Excellent,"1,001 verified reviews",9.2/10,9.0/10,8.4/10,9.0/10,8.8/10
Comfort Suites Houston NW - Vintage Park,8.0 out of 10 Very good,566 verified reviews,8.2/10,8.4/10,7.4/10,8.0/10,7.4/10
JW Marriott Houston by the Galleria,8.8 out of 10 Excellent,"1,001 verified reviews",9.2/10,9.0/10,8.4/10,8.8/10,8.6/10
"Holiday Inn Hou Energy Corridor Eldridge, an IHG Hotel",8.4 out of 10 Very good,567 verified reviews,9.2/10,8.6/10,7.8/10,8.8/10,8.2/10
Days Inn & Suites by Wyndham Houston NW Cypress,7.8 out of 10 Good,940 verified reviews,8.0/10,8.4/10,7.0/10,8.2/10,7.2/10
Home2 Suites by Hilton Houston Willowbrook,8.8 out of 10 Excellent,280 verified reviews,9.0/10,9.2/10,8.8/10,9.2/10,9.0/10
Springhill Suites By Marriott Houston Brookhollow,8.4 out of 10 Very good,"1,000 verified reviews",8.6/10,8.8/10,7.8/10,8.4/10,7.8/10
Comfort Suites Northwest - Cy - Fair,9.0 out of 10 Wonderful,641 verified reviews,9.6/10,9.2/10,7.6/10,9.4/10,8.2/10
Hampton Inn Houston-Willowbrook Mall,8.6 out of 10 Excellent,442 verified reviews,9.0/10,9.0/10,8.0/10,8.8/10,8.6/10
"Holiday Inn Express & Suites Houston NW/Beltway 8 West Road, an IHG Hotel",8.8 out of 10 Excellent,723 verified reviews,9.0/10,9.0/10,8.2/10,9.0/10,8.4/10
Econo Lodge Inn & Suites Houston Willowbrook,9.0 out of 10 Wonderful,216 verified reviews,9.4/10,9.2/10,8.4/10,9.2/10,8.4/10
The St. Regis Houston,9.2 out of 10 Wonderful,363 verified reviews,9.4/10,9.4/10,8.4/10,9.2/10,8.6/10
Ramada by Wyndham Houston Intercontinental Airport South,6.0 out of 10 Good,"1,254 verified reviews",6.4/10,7.0/10,5.8/10,5.8/10,6.6/10
Homewood Suites by Hilton Houston - Willowbrook Mall,9.0 out of 10 Wonderful,323 verified reviews,9.2/10,9.2/10,8.2/10,9.0/10,8.2/10
Americas Best Value Inn & Suites Houston at Hwy 6,8.4 out of 10 Very good,76 verified reviews,9.2/10,8.8/10,8.0/10,8.8/10,8.8/10
Quality Inn & Suites West Chase,6.8 out of 10 Good,"1,001 verified reviews",7.2/10,7.4/10,5.8/10,6.8/10,5.0/10
Comfort Inn & Suites SW Houston Sugarland,6.8 out of 10 Good,"1,002 verified reviews",7.2/10,7.4/10,6.6/10,6.8/10,6.6/10
Residence Inn by Marriott Houston Willowbrook,8.6 out of 10 Excellent,490 verified reviews,8.8/10,8.8/10,8.6/10,8.4/10,8.6/10
BESTWAY INN,7.4 out of 10 Good,8 verified reviews,7.0/10,7.6/10,6.0/10,6.6/10,7.8/10
Hampton Inn Houston Hobby Airport,7.6 out of 10 Good,702 verified reviews,8.0/10,8.2/10,7.4/10,7.6/10,7.6/10
Microtel Inn & Suites by Wyndham Houston,7.2 out of 10 Good,"1,001 verified reviews",7.4/10,7.8/10,6.6/10,7.0/10,6.8/10
"Staybridge Suites Houston Willowbrook, an IHG Hotel",8.8 out of 10 Excellent,305 verified reviews,9.0/10,9.0/10,8.2/10,8.6/10,7.6/10
TownePlace Suites by Marriott Houston Intercontinental Arpt,9.2 out of 10 Wonderful,569 verified reviews,9.4/10,9.2/10,8.6/10,9.2/10,8.8/10
"Staybridge Suites Houston West / Energy Corridor, an IHG Hotel",9.2 out of 10 Wonderful,410 verified reviews,9.4/10,9.4/10,9.4/10,9.2/10,9.0/10
Fairfield Inn & Suites Houston Intercontinental Airport,8.6 out of 10 Excellent,845 verified reviews,8.8/10,8.8/10,8.6/10,8.6/10,8.8/10
Days Inn & Suites by Wyndham Houston North/Aldine,6.2 out of 10 Good,"1,001 verified reviews",6.4/10,6.8/10,5.6/10,6.0/10,5.6/10
Days Inn by Wyndham Houston,6.4 out of 10 Good,"1,000 verified reviews",6.6/10,6.8/10,5.6/10,6.0/10,5.2/10
Courtyard Houston I-10 West/Park Row,9.0 out of 10 Wonderful,557 verified reviews,9.4/10,9.0/10,8.6/10,9.2/10,8.8/10
Rodeway Inn & Suites Highway 290 Northwest,7.2 out of 10 Good,248 verified reviews,7.4/10,7.6/10,8.2/10,6.8/10,7.6/10
Comfort Suites Bush Intercontinental Airport,7.4 out of 10 Good,748 verified reviews,7.8/10,7.8/10,6.8/10,7.2/10,6.6/10
Baymont by Wyndham Houston North,6.6 out of 10 Good,"1,002 verified reviews",6.8/10,7.0/10,6.4/10,6.4/10,5.6/10
Hampton Inn & Suites Houston I-10 West Park Row,8.8 out of 10 Excellent,480 verified reviews,9.0/10,9.0/10,8.8/10,9.0/10,8.8/10
Hampton Inn & Suites Houston-Cypress Station,7.6 out of 10 Good,424 verified reviews,8.2/10,8.2/10,7.0/10,7.6/10,7.4/10
Red Roof Inn PLUS+ Houston - Energy Corridor,6.6 out of 10 Good,"1,000 verified reviews",6.8/10,7.4/10,5.8/10,6.4/10,6.2/10
Scottish Inn & Suites,7.4 out of 10 Good,150 verified reviews,7.6/10,7.6/10,6.8/10,7.4/10,6.6/10
Super 8 by Wyndham Houston Hobby Airport South,7.4 out of 10 Good,483 verified reviews,7.8/10,7.6/10,7.2/10,7.4/10,7.0/10
Days Inn by Wyndham Houston East,6.6 out of 10 Good,149 verified reviews,7.0/10,6.8/10,6.8/10,6.4/10,6.4/10
Super 8 by Wyndham Houston Northwest Cypress,7.8 out of 10 Good,328 verified reviews,8.0/10,8.0/10,7.2/10,8.0/10,7.4/10
Hotel Bel air,7.6 out of 10 Good,51 verified reviews,7.8/10,7.6/10,6.0/10,7.6/10,7.0/10
Extended Stay America Suites Houston Westchase Richmond,5.6 out of 10,601 verified reviews,6.0/10,6.2/10,5.2/10,5.8/10,5.2/10
Red Roof Inn Houston East – I-10,6.2 out of 10 Good,658 verified reviews,6.4/10,6.8/10,5.6/10,6.0/10,6.2/10
Hampton Inn Houston Northwest,8.2 out of 10 Very good,855 verified reviews,8.8/10,8.8/10,6.6/10,8.2/10,5.8/10
Super 8 by Wyndham Houston North I-45,7.2 out of 10 Good,813 verified reviews,7.6/10,7.2/10,6.0/10,7.2/10,7.0/10
La Quinta Inn & Suites by Wyndham Houston West Park 10,6.6 out of 10 Good,"1,000 verified reviews",6.6/10,7.4/10,6.2/10,6.6/10,6.0/10
Comfort Suites Houston IAH Airport - Beltway 8,6.4 out of 10 Good,120 verified reviews,6.2/10,6.6/10,5.8/10,5.8/10,6.2/10
Extended Stay America Suites Houston Galleria Uptown,5.8 out of 10,"1,000 verified reviews",6.0/10,6.6/10,5.2/10,5.6/10,5.6/10
Regency Inn and Suites,7.8 out of 10 Good,114 verified reviews,8.6/10,7.8/10,7.0/10,8.4/10,7.6/10
Scottish Inn & Suites,7.2 out of 10 Good,195 verified reviews,7.2/10,7.6/10,6.8/10,6.6/10,6.4/10
