Hotel,Overall Rating,Total Reviews,Cleanliness,Staff and Service,Amenities,Property Conditions and Facilities,Eco-Friendliness
Best Western Prairie Inn & Conference Center,7.8 out of 10 Good,548 verified reviews,8.2/10,8.2/10,7.6/10,7.6/10,7.6/10
Best Western Grant Park Hotel,7.8 out of 10 Good,"2,537 verified reviews",7.8/10,8.4/10,7.0/10,7.2/10,7.6/10
"Club Quarters Hotel, Central Loop, Chicago",8.6 out of 10 Excellent,"2,893 verified reviews",8.8/10,9.0/10,8.0/10,8.4/10,8.4/10
Central Loop Hotel,8.6 out of 10 Excellent,"1,545 verified reviews",8.6/10,9.0/10,8.0/10,8.2/10,8.4/10
Tru by Hilton Naperville Chicago,9.0 out of 10 Wonderful,262 verified reviews,9.4/10,9.4/10,9.0/10,9.4/10,9.4/10
Congress Plaza Hotel,7.6 out of 10 Good,"6,387 verified reviews",7.8/10,8.0/10,7.0/10,6.8/10,7.2/10
Ohio House Motel,9.0 out of 10 Wonderful,"1,001 verified reviews",9.2/10,9.4/10,8.4/10,8.8/10,8.8/10
"Club Quarters Hotel Wacker at Michigan, Chicago",8.6 out of 10 Excellent,"1,725 verified reviews",8.8/10,9.0/10,7.8/10,8.4/10,8.4/10
River Hotel,8.8 out of 10 Excellent,"2,678 verified reviews",9.0/10,9.2/10,8.2/10,8.6/10,8.8/10
Holiday Inn Chicago O'Hare - Rosemont,8.4 out of 10 Very good,759 verified reviews,9.2/10,8.6/10,9.0/10,9.0/10,8.8/10
La Quinta Inn & Suites by Wyndham Chicago Downtown,8.6 out of 10 Excellent,"2,313 verified reviews",8.8/10,8.8/10,8.0/10,8.6/10,8.4/10
Hampton Inn Chicago Orland Park,9.2 out of 10 Wonderful,108 verified reviews,9.4/10,9.6/10,9.4/10,9.6/10,9.2/10
The Peninsula Chicago,9.8 out of 10 Exceptional,"1,003 verified reviews",10.0/10,9.8/10,9.8/10,10.0/10,9.6/10
Comfort Inn & Suites near Route 66,8.4 out of 10 Very good,246 verified reviews,8.4/10,9.0/10,8.4/10,8.2/10,8.2/10
Hotel Felix River North/Magnificent Mile,7.8 out of 10 Good,"1,004 verified reviews",8.4/10,8.2/10,7.4/10,8.0/10,8.0/10
Trump International Hotel & Tower Chicago,9.2 out of 10 Wonderful,"1,120 verified reviews",9.6/10,9.6/10,9.4/10,9.6/10,9.4/10
Travelodge by Wyndham Downtown Chicago,6.4 out of 10 Good,"1,573 verified reviews",6.6/10,7.2/10,5.6/10,5.8/10,6.2/10
Home2 Suites by Hilton Loves Park Rockford,9.6 out of 10 Exceptional,335 verified reviews,9.8/10,9.8/10,9.6/10,9.8/10,9.6/10
Comfort Inn & Suites Mundelein-Vernon Hills,7.6 out of 10 Good,900 verified reviews,7.8/10,8.0/10,7.0/10,7.4/10,6.6/10
Freehand Chicago,7.8 out of 10 Good,"1,010 verified reviews",8.2/10,8.2/10,7.6/10,7.8/10,7.8/10
"Ambassador Chicago, part of JdV by Hyatt",8.8 out of 10 Excellent,"1,004 verified reviews",9.2/10,9.2/10,8.2/10,8.6/10,8.4/10
The Sono Chicago,10 out of 10 Exceptional,402 verified reviews,10.0/10,10.0/10,9.8/10,10.0/10,9.8/10
Hilton Chicago/Magnificent Mile Suites,8.6 out of 10 Excellent,"1,393 verified reviews",9.0/10,9.0/10,8.2/10,8.6/10,8.6/10
The Drake,8.2 out of 10 Very good,"1,003 verified reviews",8.6/10,8.8/10,7.8/10,8.0/10,8.2/10
Ramada by Wyndham Effingham,7.8 out of 10 Good,698 verified reviews,7.8/10,8.6/10,7.2/10,7.4/10,7.6/10
"Sable at Navy Pier Chicago, Curio Collection by Hilton",9.2 out of 10 Wonderful,"1,861 verified reviews",9.6/10,9.4/10,8.8/10,9.6/10,9.4/10
The Buckingham Hotel,8.8 out of 10 Excellent,"1,001 verified reviews",9.2/10,8.8/10,8.4/10,8.8/10,8.8/10
DoubleTree by Hilton Chicago - Magnificent Mile,8.6 out of 10 Excellent,"2,112 verified reviews",8.8/10,8.8/10,8.4/10,8.8/10,8.6/10
"Bluegreen Vacations Hotel Blake, Ascend Resort Collection",9.6 out of 10 Exceptional,"1,006 verified reviews",9.8/10,9.6/10,9.0/10,9.6/10,9.2/10
Courtyard by Marriott Chicago Magnificent Mile,8.6 out of 10 Excellent,"1,100 verified reviews",9.0/10,8.8/10,8.2/10,8.8/10,8.6/10
"Thompson Chicago, by Hyatt",9.0 out of 10 Wonderful,"1,004 verified reviews",9.4/10,9.2/10,8.6/10,9.0/10,9.0/10
Canopy by Hilton Chicago Central Loop,9.4 out of 10 Exceptional,693 verified reviews,9.8/10,9.4/10,9.2/10,9.6/10,9.4/10
The Talbott Hotel,8.8 out of 10 Excellent,"1,002 verified reviews",9.2/10,9.0/10,8.0/10,8.6/10,8.6/10
The Chateau Hotel and Conference Center,8.0 out of 10 Very good,"1,199 verified reviews",8.2/10,8.4/10,7.6/10,7.4/10,7.8/10
Hampton Inn Chicago - Gurnee,8.6 out of 10 Excellent,"1,001 verified reviews",8.8/10,9.0/10,8.2/10,8.6/10,8.0/10
"Country Inn & Suites by Radisson, Elk Grove Village/Itasca",8.4 out of 10 Very good,"1,000 verified reviews",8.8/10,8.6/10,8.0/10,8.4/10,8.0/10
La Quinta by Wyndham Chicago O'Hare Airport,8.0 out of 10 Very good,263 verified reviews,8.8/10,8.2/10,7.8/10,8.8/10,8.6/10
Hotel Lincoln,8.2 out of 10 Very good,"1,002 verified reviews",8.4/10,8.8/10,7.6/10,7.8/10,8.0/10
Cambria Hotel Chicago Loop - Theatre District,8.6 out of 10 Excellent,"1,041 verified reviews",8.6/10,8.8/10,8.0/10,8.6/10,8.4/10
Aloft Chicago Mag Mile,8.4 out of 10 Very good,"2,197 verified reviews",8.6/10,8.8/10,8.4/10,8.6/10,8.6/10
"LondonHouse Chicago, Curio Collection by Hilton",9.2 out of 10 Wonderful,"3,480 verified reviews",9.6/10,9.2/10,9.2/10,9.4/10,9.2/10
DoubleTree by Hilton Chicago - Alsip,8.2 out of 10 Very good,"1,002 verified reviews",8.6/10,8.6/10,7.6/10,8.4/10,8.2/10
Eurostars Magnificent Mile,8.4 out of 10 Very good,"1,835 verified reviews",8.8/10,8.8/10,7.2/10,8.2/10,8.2/10
Four Seasons Hotel Chicago,9.4 out of 10 Exceptional,"1,000 verified reviews",9.8/10,9.6/10,9.4/10,9.4/10,9.4/10
"voco Chicago Downtown, an IHG Hotel",8.8 out of 10 Excellent,"1,040 verified reviews",9.2/10,8.8/10,9.2/10,9.0/10,9.0/10
Hampton Inn Chicago Downtown/Magnificent Mile,8.4 out of 10 Very good,"1,061 verified reviews",8.4/10,8.8/10,7.8/10,8.0/10,8.2/10
Hampton Inn Majestic Chicago Theatre District,9.2 out of 10 Wonderful,"1,002 verified reviews",9.4/10,9.6/10,8.6/10,9.0/10,8.8/10
Hilton Garden Inn Chicago Central Loop,9.2 out of 10 Wonderful,703 verified reviews,9.6/10,9.2/10,8.8/10,9.6/10,9.0/10
Palmer House a Hilton Hotel,8.0 out of 10 Very good,"1,140 verified reviews",8.6/10,8.6/10,7.8/10,8.0/10,8.0/10
"The Ritz-Carlton, Chicago",9.2 out of 10 Wonderful,"1,001 verified reviews",9.6/10,9.4/10,9.0/10,9.2/10,9.2/10
Antioch Hotel & Suites,8.8 out of 10 Excellent,77 verified reviews,9.0/10,9.0/10,8.0/10,9.0/10,8.6/10
Ramada Limited Decatur,6.8 out of 10 Good,664 verified reviews,7.0/10,7.6/10,6.4/10,6.6/10,6.0/10
Best Western At O'Hare,7.2 out of 10 Good,"1,600 verified reviews",7.4/10,7.6/10,6.8/10,6.8/10,7.2/10
Loews Chicago Hotel,9.2 out of 10 Wonderful,"1,493 verified reviews",9.6/10,9.4/10,9.2/10,9.6/10,9.2/10
Hilton Garden Inn Chicago Downtown Riverwalk,9.0 out of 10 Wonderful,"1,794 verified reviews",9.2/10,9.2/10,8.4/10,9.0/10,8.6/10
Hilton Garden Inn Chicago Downtown South Loop,8.6 out of 10 Excellent,"1,659 verified reviews",9.0/10,8.6/10,8.4/10,9.0/10,8.6/10
Residence Inn by Marriott Chicago Downtown / River North,8.8 out of 10 Excellent,"1,005 verified reviews",9.0/10,9.0/10,8.4/10,8.8/10,8.6/10
Embassy Suites by Hilton E Peoria Riverfront Conf Center,8.2 out of 10 Very good,"1,080 verified reviews",8.2/10,8.8/10,8.2/10,8.0/10,8.4/10
Hampton Inn Collinsville,8.4 out of 10 Very good,622 verified reviews,8.8/10,8.8/10,8.4/10,8.4/10,8.6/10
Homewood Suites by Hilton Chicago-Downtown,8.4 out of 10 Very good,"1,001 verified reviews",8.6/10,8.8/10,8.0/10,8.2/10,8.4/10
Homewood Suites by Hilton Chicago Downtown/Magnificent Mile,8.4 out of 10 Very good,"1,002 verified reviews",8.6/10,8.8/10,8.2/10,8.4/10,8.0/10
Swissotel - Chicago,8.6 out of 10 Excellent,"2,034 verified reviews",9.2/10,8.8/10,8.4/10,9.0/10,8.8/10
"Holiday Inn Chicago Dwtn Wolf Point, an IHG Hotel",8.8 out of 10 Excellent,"1,006 verified reviews",9.2/10,9.0/10,8.6/10,9.0/10,9.0/10
Le Méridien Essex Chicago,8.4 out of 10 Very good,"1,001 verified reviews",9.2/10,8.8/10,8.4/10,9.0/10,8.6/10
Baymont by Wyndham Rockford,8.6 out of 10 Excellent,"1,004 verified reviews",8.8/10,8.8/10,8.2/10,8.4/10,8.6/10
Econo Lodge,8.2 out of 10 Very good,362 verified reviews,8.6/10,8.6/10,7.6/10,8.2/10,8.2/10
Park Hyatt Chicago,9.6 out of 10 Exceptional,962 verified reviews,9.6/10,9.6/10,9.6/10,9.4/10,9.2/10
Fairmont Chicago at Millennium Park Gold Experience,9.0 out of 10 Wonderful,94 verified reviews,9.4/10,9.2/10,9.0/10,9.0/10,9.0/10
Homewood Suites by Hilton Chicago Downtown South Loop,8.6 out of 10 Excellent,"1,754 verified reviews",8.8/10,8.6/10,8.4/10,8.8/10,8.8/10
Ramada by Wyndham Vandalia,7.8 out of 10 Good,662 verified reviews,8.0/10,8.6/10,7.4/10,7.6/10,7.6/10
Hyatt Place Chicago/River North,9.0 out of 10 Wonderful,"1,379 verified reviews",9.2/10,9.2/10,8.6/10,9.0/10,8.8/10
Hampton Inn Chicago Downtown/N Loop/Michigan Ave,8.4 out of 10 Very good,"1,084 verified reviews",8.6/10,8.8/10,8.2/10,8.4/10,8.2/10
Walker's Bluff Casino Resort,9.0 out of 10 Wonderful,98 verified reviews,9.8/10,9.2/10,8.6/10,9.6/10,9.0/10
Embassy Suites by Hilton Chicago Downtown Magnificent Mile,8.2 out of 10 Very good,"2,362 verified reviews",8.2/10,8.6/10,8.2/10,8.2/10,8.2/10
Home2 Suites by Hilton Chicago River North,8.4 out of 10 Very good,"1,415 verified reviews",8.8/10,8.6/10,8.2/10,8.6/10,8.6/10
Kasa Magnificent Mile Chicago,9.2 out of 10 Wonderful,194 verified reviews,9.4/10,9.0/10,8.6/10,9.2/10,9.0/10
Millennium Knickerbocker Chicago,7.8 out of 10 Good,"1,763 verified reviews",8.4/10,8.0/10,7.0/10,7.8/10,7.6/10
21c Museum Hotel Chicago,8.4 out of 10 Very good,"1,801 verified reviews",9.0/10,8.6/10,8.2/10,8.8/10,8.6/10
"theWit Chicago, a Hilton Hotel",8.8 out of 10 Excellent,"1,003 verified reviews",9.2/10,9.2/10,8.6/10,9.0/10,8.8/10
Baymont by Wyndham Effingham,7.8 out of 10 Good,698 verified reviews,8.2/10,8.4/10,7.6/10,7.4/10,7.6/10
Hawthorn Suites by Wyndham Bloomington,7.6 out of 10 Good,"1,001 verified reviews",7.2/10,8.2/10,7.4/10,7.2/10,7.6/10
Baymont by Wyndham Marion,8.0 out of 10 Very good,"1,001 verified reviews",8.0/10,8.4/10,7.4/10,7.6/10,7.8/10
Hilton Chicago,8.4 out of 10 Very good,"1,004 verified reviews",8.8/10,8.8/10,8.2/10,8.6/10,8.4/10
Super 8 by Wyndham Mt. Vernon IL,7.8 out of 10 Good,"1,002 verified reviews",7.8/10,8.2/10,7.2/10,7.2/10,7.4/10
Radisson Blu Aqua Hotel Chicago,8.2 out of 10 Very good,"1,530 verified reviews",8.4/10,8.4/10,8.2/10,8.4/10,8.4/10
"Chicago Athletic Association, a Hyatt Hotel",9.0 out of 10 Wonderful,"1,006 verified reviews",9.6/10,9.4/10,9.0/10,9.2/10,8.8/10
Drury Inn & Suites Mt. Vernon,9.6 out of 10 Exceptional,"1,080 verified reviews",9.6/10,9.8/10,9.6/10,9.6/10,9.4/10
"Kimpton Gray Hotel, an IHG Hotel",9.4 out of 10 Exceptional,"1,000 verified reviews",9.6/10,9.6/10,9.0/10,9.6/10,9.2/10
Fairmont Chicago at Millennium Park,8.6 out of 10 Excellent,"1,421 verified reviews",9.0/10,8.8/10,8.2/10,8.6/10,8.6/10
La Quinta Inn & Suites by Wyndham Springfield IL,8.0 out of 10 Very good,"1,003 verified reviews",8.4/10,8.2/10,8.0/10,8.2/10,8.2/10
Microtel Inn & Suites by Wyndham Springfield,7.6 out of 10 Good,"1,002 verified reviews",7.6/10,8.0/10,7.6/10,7.4/10,7.8/10
Days Inn by Wyndham Charleston,7.6 out of 10 Good,676 verified reviews,8.0/10,8.4/10,6.8/10,7.6/10,7.2/10
Best Western Plus Chicagoland - Countryside,8.6 out of 10 Excellent,"1,003 verified reviews",8.8/10,9.0/10,8.2/10,8.6/10,8.2/10
"Hotel EMC2, Autograph Collection",9.4 out of 10 Exceptional,999 verified reviews,9.8/10,9.6/10,9.0/10,9.6/10,9.4/10
Fairfield Inn & Suites Chicago Downtown/River North,9.2 out of 10 Wonderful,"1,002 verified reviews",9.4/10,9.6/10,8.8/10,9.4/10,9.0/10
Hyatt Centric Chicago Magnificent Mile,8.8 out of 10 Excellent,"1,270 verified reviews",9.2/10,9.2/10,8.6/10,9.0/10,8.8/10
Bridgeview Inn Chicago Area,7.0 out of 10 Good,13 verified reviews,6.8/10,5.8/10,5.0/10,6.6/10,6.4/10
Hyatt Centric The Loop Chicago,8.8 out of 10 Excellent,"1,005 verified reviews",9.0/10,9.0/10,8.4/10,8.8/10,8.6/10
Hampton Inn & Suites Chicago Downtown,8.8 out of 10 Excellent,"1,003 verified reviews",9.2/10,9.0/10,8.8/10,9.0/10,8.8/10
Embassy Suites by Hilton Chicago Downtown River North,8.0 out of 10 Very good,"2,124 verified reviews",8.2/10,8.4/10,8.2/10,7.8/10,8.0/10
Best Western Plus Bloomington East Hotel,8.8 out of 10 Excellent,768 verified reviews,8.8/10,9.2/10,8.4/10,8.6/10,8.4/10
Baymont by Wyndham Morton,7.8 out of 10 Good,734 verified reviews,8.0/10,8.2/10,8.2/10,7.8/10,8.2/10
Illini Inn & Suites Hotel - Rantoul/Gifford/Champaign/Urbana,7.8 out of 10 Good,18 verified reviews,7.8/10,8.6/10,7.2/10,7.2/10,8.0/10
Baymont by Wyndham Gurnee,7.6 out of 10 Good,"1,003 verified reviews",7.6/10,8.2/10,7.2/10,7.2/10,7.6/10
Quality Inn Effingham,8.2 out of 10 Very good,636 verified reviews,8.6/10,8.6/10,8.4/10,8.2/10,8.6/10
Hyatt Regency Chicago,9.0 out of 10 Wonderful,"3,488 verified reviews",9.0/10,9.0/10,8.6/10,8.8/10,8.6/10
Moxy Chicago Downtown,9.2 out of 10 Wonderful,627 verified reviews,9.8/10,9.6/10,8.8/10,9.6/10,9.2/10
"InterContinental Chicago Magnificent Mile, an IHG Hotel",8.6 out of 10 Excellent,"1,496 verified reviews",9.0/10,9.0/10,8.4/10,8.6/10,8.6/10
"Country Inn & Suites by Radisson, Decatur, IL",8.0 out of 10 Very good,860 verified reviews,8.2/10,8.6/10,7.4/10,7.8/10,7.4/10
"Route 66 Hotel, Springfield, Illinois",6.8 out of 10 Good,996 verified reviews,6.8/10,7.6/10,6.2/10,6.4/10,6.8/10
Heritage Grand Inn,8.6 out of 10 Excellent,235 verified reviews,9.0/10,9.0/10,7.6/10,8.4/10,9.0/10
"Country Inn & Suites by Radisson, Manteno, IL",8.2 out of 10 Very good,"1,000 verified reviews",8.4/10,8.6/10,8.0/10,8.0/10,8.0/10
"Country Inn & Suites by Radisson, Galena, IL",9.4 out of 10 Exceptional,"1,000 verified reviews",9.4/10,9.6/10,9.2/10,9.4/10,9.0/10
Hilton Garden Inn Chicago Downtown/Magnificent Mile,8.0 out of 10 Very good,"1,700 verified reviews",8.4/10,8.2/10,7.8/10,8.2/10,8.2/10
"Kimpton Hotel Monaco Chicago, an IHG Hotel",9.4 out of 10 Exceptional,"1,003 verified reviews",9.6/10,9.6/10,9.0/10,9.4/10,9.0/10
La Quinta Inn & Suites by Wyndham Rockford,7.8 out of 10 Good,"1,000 verified reviews",8.2/10,8.4/10,7.8/10,7.8/10,7.8/10
AC Hotels by Marriott Chicago Downtown,8.6 out of 10 Excellent,"1,002 verified reviews",9.0/10,8.8/10,8.4/10,8.8/10,8.8/10
Eastland Suites Hotel & Conference Center,8.8 out of 10 Excellent,"1,000 verified reviews",9.0/10,9.2/10,8.6/10,8.6/10,8.2/10
Springhill Suites by Marriott Chicago Downtown/ River North,8.8 out of 10 Excellent,"1,052 verified reviews",8.8/10,9.0/10,8.4/10,8.8/10,8.6/10
Riverbank Lodge,9.0 out of 10 Wonderful,272 verified reviews,9.2/10,9.4/10,8.8/10,9.0/10,9.0/10
Super 8 by Wyndham Chicago O'Hare Airport,7.8 out of 10 Good,"1,002 verified reviews",8.0/10,8.2/10,7.2/10,7.4/10,7.4/10
"Holiday Inn Chicago - Elk Grove, an IHG Hotel",7.6 out of 10 Good,"1,000 verified reviews",8.2/10,8.0/10,7.4/10,7.8/10,7.4/10
"Red Roof Inn & Suites Danville, IL",7.8 out of 10 Good,"1,001 verified reviews",8.0/10,8.4/10,7.2/10,7.6/10,7.6/10
"Country Inn & Suites by Radisson, Effingham, IL",8.8 out of 10 Excellent,"1,001 verified reviews",9.0/10,9.2/10,8.6/10,8.6/10,8.4/10
Days Inn by Wyndham Oglesby/ Starved Rock,8.2 out of 10 Very good,905 verified reviews,8.4/10,8.6/10,7.6/10,8.0/10,8.0/10
La Quinta Inn & Suites by Wyndham Effingham,8.8 out of 10 Excellent,"1,001 verified reviews",9.0/10,9.2/10,8.8/10,9.0/10,8.8/10
Red Roof Inn Bloomington - Normal/ University,6.8 out of 10 Good,553 verified reviews,7.0/10,7.6/10,6.4/10,6.6/10,6.0/10
Comfort Suites Chicago O'Hare Airport,8.4 out of 10 Very good,"1,812 verified reviews",8.4/10,8.6/10,8.0/10,8.0/10,8.0/10
AmericInn by Wyndham Princeton IL,9.2 out of 10 Wonderful,268 verified reviews,9.4/10,9.4/10,9.0/10,9.2/10,8.6/10
AmericInn by Wyndham Monmouth,8.8 out of 10 Excellent,325 verified reviews,9.0/10,9.2/10,8.6/10,9.0/10,8.4/10
The Chicago Hotel Collection - Magnificent Mile,8.2 out of 10 Very good,"1,004 verified reviews",8.6/10,8.2/10,7.2/10,8.2/10,8.0/10
Sonesta Select Chicago Elgin West Dundee,8.4 out of 10 Very good,812 verified reviews,8.4/10,8.8/10,7.8/10,8.2/10,8.2/10
Fairfield Inn & Suites Chicago Downtown / Magnificent Mile,8.6 out of 10 Excellent,"1,001 verified reviews",9.0/10,9.2/10,8.2/10,8.6/10,8.6/10
Fairfield Inn & Suites by Marriott Rockford,9.0 out of 10 Wonderful,737 verified reviews,9.4/10,9.2/10,8.4/10,9.0/10,9.0/10
Courtyard by Marriott Chicago Arlington Heights / South,8.6 out of 10 Excellent,992 verified reviews,9.0/10,9.0/10,8.2/10,8.6/10,8.4/10
Stoney Creek Inn Quincy,8.6 out of 10 Excellent,"1,001 verified reviews",8.8/10,9.0/10,8.6/10,8.8/10,8.6/10
SureStay Plus Hotel by Best Western Chicago Lombard,8.6 out of 10 Excellent,"1,447 verified reviews",8.8/10,9.2/10,8.2/10,8.4/10,8.4/10
Ramada Limited Bloomington,6.8 out of 10 Good,"1,001 verified reviews",7.2/10,7.6/10,6.2/10,6.8/10,6.0/10
W Chicago - City Center,8.0 out of 10 Very good,"1,001 verified reviews",8.6/10,8.4/10,8.0/10,8.0/10,8.0/10
AmericInn by Wyndham Woodstock IL,8.0 out of 10 Very good,738 verified reviews,8.4/10,8.6/10,7.8/10,8.0/10,7.2/10
"Crowne Plaza Chicago Ohare Hotel & Conf Ctr, and IHG Hotel",8.4 out of 10 Very good,"1,521 verified reviews",8.6/10,8.8/10,8.2/10,8.4/10,8.4/10
Residence Inn Chicago Downtown/Loop,9.4 out of 10 Exceptional,"1,002 verified reviews",9.4/10,9.4/10,9.2/10,9.4/10,9.0/10
"Country Inn & Suites by Radisson, Bloomington-Normal West, IL",7.4 out of 10 Good,"1,001 verified reviews",7.6/10,8.0/10,6.8/10,7.0/10,7.0/10
Courtyard by Marriott Chicago Downtown River North,8.8 out of 10 Excellent,"1,001 verified reviews",9.0/10,9.2/10,8.0/10,8.8/10,8.4/10
Hyatt Place Bloomington/Normal,9.2 out of 10 Wonderful,"1,002 verified reviews",9.4/10,9.4/10,9.0/10,9.4/10,9.0/10
"The Gwen, a Luxury Collection Hotel, Michigan Avenue Chicago",9.4 out of 10 Exceptional,"1,001 verified reviews",9.6/10,9.2/10,9.0/10,9.4/10,9.4/10
Best Western Airport Inn,8.4 out of 10 Very good,894 verified reviews,8.8/10,8.8/10,8.0/10,8.4/10,8.0/10
Wingate by Wyndham Arlington Heights,8.0 out of 10 Very good,"1,002 verified reviews",8.2/10,8.2/10,8.0/10,8.0/10,8.0/10
Best Western Chester Hotel,8.6 out of 10 Excellent,243 verified reviews,9.2/10,9.0/10,7.8/10,8.8/10,8.6/10
Best Western Plus Parkway Hotel,8.4 out of 10 Very good,989 verified reviews,8.6/10,8.6/10,8.0/10,8.4/10,8.0/10
Wyndham Garden Galena Hotel & Day Spa,9.4 out of 10 Exceptional,187 verified reviews,9.8/10,9.6/10,9.4/10,9.4/10,9.4/10
Super 8 by Wyndham Rantoul,7.0 out of 10 Good,378 verified reviews,7.2/10,7.6/10,6.8/10,7.0/10,7.6/10
Super 8 by Wyndham Peoria,7.2 out of 10 Good,"1,002 verified reviews",7.4/10,7.8/10,6.6/10,7.0/10,6.8/10
Best Western Delta Inn,9.2 out of 10 Wonderful,996 verified reviews,9.4/10,9.4/10,9.0/10,9.2/10,8.8/10
Quality Inn Bolingbrook I-55,8.4 out of 10 Very good,743 verified reviews,8.6/10,8.6/10,8.0/10,8.2/10,8.2/10
Sheraton Grand Chicago Riverwalk,8.4 out of 10 Very good,"1,318 verified reviews",8.8/10,8.6/10,8.0/10,8.4/10,8.4/10
Best Western Morton Inn,9.0 out of 10 Wonderful,394 verified reviews,9.4/10,9.4/10,9.0/10,9.2/10,8.8/10
W Chicago - Lakeshore,8.2 out of 10 Very good,"1,001 verified reviews",8.6/10,8.6/10,7.6/10,8.2/10,8.2/10
"Country Inn & Suites by Radisson, Moline Airport, IL",8.4 out of 10 Very good,931 verified reviews,8.6/10,8.8/10,8.0/10,8.4/10,8.0/10
Comfort Inn & Suites North Aurora - Naperville,8.2 out of 10 Very good,464 verified reviews,8.4/10,8.6/10,8.0/10,8.2/10,8.0/10
Best Western O'Hare/Elk Grove Hotel,8.2 out of 10 Very good,"1,001 verified reviews",8.4/10,8.6/10,7.6/10,8.0/10,7.6/10
La Quinta Inn & Suites by Wyndham Chicago Gurnee,7.2 out of 10 Good,"1,004 verified reviews",7.4/10,7.8/10,7.2/10,7.0/10,7.4/10
Stone Creek Inn,6.0 out of 10 Good,4 verified reviews,7.6/10,8.0/10,10.0/10,6.0/10,6.0/10
The Chicago Hotel Collection River North,7.0 out of 10 Good,277 verified reviews,8.2/10,7.2/10,7.0/10,7.8/10,7.6/10
Best Western Naperville Inn,8.2 out of 10 Very good,"1,001 verified reviews",8.4/10,8.6/10,8.0/10,8.2/10,8.0/10
Radisson Hotel Schaumburg,7.2 out of 10 Good,391 verified reviews,7.6/10,7.6/10,6.8/10,7.2/10,7.4/10
Best Western Plus Champaign/Urbana Inn,8.8 out of 10 Excellent,797 verified reviews,9.2/10,9.0/10,8.8/10,8.8/10,8.8/10
"Drury Inn & Suites St. Louis O'Fallon, IL",9.6 out of 10 Exceptional,"1,003 verified reviews",9.6/10,9.6/10,9.4/10,9.6/10,9.4/10
"Holiday Inn Express Troy, an IHG Hotel",9.4 out of 10 Exceptional,502 verified reviews,9.4/10,9.4/10,9.2/10,9.4/10,9.2/10
Hampton Inn by Hilton Huntley Chicago,9.4 out of 10 Exceptional,108 verified reviews,9.8/10,9.4/10,9.2/10,9.8/10,9.2/10
Lefevre Inn and Resort,9.6 out of 10 Exceptional,511 verified reviews,9.6/10,9.8/10,9.2/10,9.6/10,9.4/10
JW Marriott Chicago,9.2 out of 10 Wonderful,"1,000 verified reviews",9.4/10,9.2/10,9.0/10,9.4/10,9.2/10
Hyatt Place Chicago/O'Hare Airport,8.4 out of 10 Very good,"2,208 verified reviews",8.8/10,8.6/10,8.2/10,8.6/10,8.4/10
Renaissance Chicago Downtown Hotel,9.2 out of 10 Wonderful,"1,004 verified reviews",9.4/10,9.4/10,8.8/10,9.2/10,9.0/10
Inn at 835 Boutique Hotel,9.4 out of 10 Exceptional,397 verified reviews,9.6/10,9.6/10,9.2/10,9.2/10,9.0/10
Best Western Legacy Inn & Suites Beloit/South Beloit,8.8 out of 10 Excellent,619 verified reviews,9.2/10,9.2/10,9.0/10,9.0/10,9.0/10
Best Western Plus South Holland/Chicago Southland,8.4 out of 10 Very good,215 verified reviews,8.6/10,8.6/10,8.4/10,8.6/10,8.4/10
Super 8 by Wyndham Marion,7.8 out of 10 Good,"1,000 verified reviews",8.0/10,8.2/10,6.8/10,7.4/10,6.8/10
Best Western Premier Alton-St. Louis Area Hotel,7.8 out of 10 Good,586 verified reviews,8.6/10,8.2/10,8.0/10,8.0/10,7.8/10
Country Hearth Inn & Suites Edwardsville St. Louis,8.6 out of 10 Excellent,494 verified reviews,9.0/10,9.0/10,8.2/10,8.6/10,8.8/10
Best Western Galena Inn & Suites,8.6 out of 10 Excellent,"1,001 verified reviews",8.8/10,8.8/10,8.2/10,8.4/10,8.2/10
MainStay Suites Bourbonnais - Kankakee,8.4 out of 10 Very good,28 verified reviews,9.0/10,8.8/10,7.0/10,8.6/10,8.8/10
Best Western Plus Pontoon Beach,8.6 out of 10 Excellent,468 verified reviews,9.0/10,8.8/10,8.6/10,8.8/10,8.4/10
"Staybridge Suites Chicago O'Hare - Rosemont, an IHG Hotel",8.0 out of 10 Very good,"1,002 verified reviews",8.6/10,8.4/10,7.8/10,8.2/10,8.8/10
Super 8 by Wyndham Gurnee,6.8 out of 10 Good,"1,001 verified reviews",7.2/10,7.4/10,6.4/10,6.6/10,6.4/10
The Westin Michigan Avenue Chicago,8.6 out of 10 Excellent,"1,006 verified reviews",9.0/10,8.8/10,8.2/10,8.6/10,8.4/10
"Country Inn & Suites by Radisson, Stockton, IL",8.8 out of 10 Excellent,466 verified reviews,9.0/10,9.2/10,8.0/10,8.8/10,8.2/10
Sonesta Simply Suites Chicago O'Hare Airport,8.4 out of 10 Very good,"1,264 verified reviews",8.6/10,8.8/10,8.2/10,8.4/10,8.4/10
Best Western Plus Green Mill Village Hotel & Suites,9.4 out of 10 Exceptional,565 verified reviews,9.6/10,9.6/10,9.2/10,9.6/10,9.2/10
"Country Inn & Suites by Radisson, Gurnee, IL",8.2 out of 10 Very good,"1,001 verified reviews",8.4/10,8.6/10,7.6/10,8.0/10,8.0/10
"Country Inn & Suites by Radisson, Hoffman Estates, IL",7.8 out of 10 Good,"1,002 verified reviews",8.0/10,8.0/10,8.0/10,7.8/10,7.8/10
"Holiday Inn Chicago North-Evanston, an IHG Hotel",8.0 out of 10 Very good,"1,002 verified reviews",8.4/10,8.4/10,7.8/10,8.0/10,8.0/10
The Inn at Old Nauvoo,8.8 out of 10 Excellent,222 verified reviews,9.0/10,9.2/10,8.0/10,8.4/10,8.6/10
Ramada by Wyndham Springfield North,9.2 out of 10 Wonderful,"1,000 verified reviews",9.2/10,9.4/10,9.0/10,9.2/10,9.0/10
Hotel Galena,9.8 out of 10 Exceptional,80 verified reviews,10.0/10,9.8/10,9.4/10,9.6/10,9.8/10
Chicago Club Inn & Suites,6.0 out of 10 Good,"1,006 verified reviews",5.8/10,6.8/10,5.8/10,5.6/10,6.2/10
"Country Inn & Suites by Radisson, Crystal Lake, IL",8.6 out of 10 Excellent,916 verified reviews,8.8/10,9.0/10,8.4/10,8.4/10,8.6/10
The Villa Toscana,7.6 out of 10 Good,412 verified reviews,8.0/10,8.2/10,6.0/10,7.6/10,6.0/10
Best Western Des Plaines Inn,7.6 out of 10 Good,"1,001 verified reviews",8.0/10,8.0/10,7.2/10,7.4/10,7.4/10
The Westin Chicago River North,9.2 out of 10 Wonderful,"1,000 verified reviews",9.4/10,9.2/10,8.6/10,9.2/10,9.0/10
Cobblestone Hotel & Suites - Newton,9.4 out of 10 Exceptional,270 verified reviews,9.6/10,9.4/10,8.8/10,9.4/10,8.8/10
"Country Inn & Suites by Radisson, Fairview Heights, IL",7.4 out of 10 Good,549 verified reviews,7.6/10,8.2/10,6.8/10,7.0/10,7.2/10
Red Roof Inn PLUS+ Chicago - Northbrook/ Deerfield,7.6 out of 10 Good,"1,000 verified reviews",8.0/10,8.2/10,6.8/10,7.6/10,7.6/10
Wyndham Garden Elk Grove Village/O'Hare,8.4 out of 10 Very good,"1,002 verified reviews",9.0/10,8.4/10,8.0/10,8.8/10,8.4/10
Best Western Chicago - Downers Grove,8.4 out of 10 Very good,"1,236 verified reviews",8.8/10,8.8/10,8.2/10,8.4/10,8.4/10
Courtyard by Marriott Chicago Glenview/Northbrook,8.6 out of 10 Excellent,891 verified reviews,9.0/10,9.0/10,8.0/10,8.6/10,8.2/10
Nauvoo Temple House Hotel,8.8 out of 10 Excellent,109 verified reviews,9.2/10,8.8/10,7.8/10,8.6/10,8.6/10
"Parke Regency Hotel & Conf Ctr, BW Signature Collection",8.2 out of 10 Very good,"1,003 verified reviews",8.6/10,8.8/10,8.0/10,8.2/10,8.2/10
Baymont by Wyndham Freeport,8.0 out of 10 Very good,531 verified reviews,8.2/10,8.8/10,8.0/10,7.8/10,8.2/10
The Champagne Lodge & Luxury Suites,8.4 out of 10 Very good,"1,004 verified reviews",8.6/10,8.8/10,8.4/10,8.4/10,8.4/10
Best Western Plus MidAmerica Hotel,9.0 out of 10 Wonderful,"1,001 verified reviews",9.2/10,9.0/10,8.6/10,9.0/10,9.0/10
Best Western Clearlake Plaza,8.4 out of 10 Very good,612 verified reviews,8.6/10,8.8/10,8.0/10,8.4/10,8.2/10
Extended Stay America Suites Chicago Itasca,7.6 out of 10 Good,750 verified reviews,7.8/10,7.8/10,7.0/10,7.6/10,7.8/10
Extended Stay America Suites Chicago Burr Ridge,7.4 out of 10 Good,820 verified reviews,7.4/10,7.8/10,7.2/10,7.2/10,7.2/10
Best Western Plus Bourbonnais Hotel & Suites,8.2 out of 10 Very good,265 verified reviews,8.6/10,8.6/10,8.4/10,8.4/10,8.4/10
"Country Inn & Suites by Radisson, Springfield, IL",8.4 out of 10 Very good,"1,002 verified reviews",8.6/10,8.8/10,8.2/10,8.4/10,8.2/10
Hyatt Rosemont,8.4 out of 10 Very good,"1,001 verified reviews",8.8/10,8.6/10,8.0/10,8.4/10,8.2/10
